 Estou com a sensação de que tudo faz sentido;alegria
 Sinto uma enorme felicidade em estar vivo;alegria
 Estou com a sensação de que tudo está se encaixando;alegria
 Sinto uma grande satisfação em ajudar os outros;alegria
 Estou com a sensação de que tudo está fluindo;alegria
 Sinto uma grande felicidade em compartilhar com as pessoas que amo;alegria
 Estou com a sensação de que tudo está em harmonia;alegria
 Sinto uma grande felicidade em estar presente no momento presente;alegria
 Sinto uma tranquilidade interior absoluta;neutro
 Estou em paz comigo mesmo e com o mundo;neutro
 Sinto uma sensação de equilíbrio interior;neutro
 Estou com a mente calma e serena;neutro
 Sinto uma sensação de leveza e serenidade;neutro
 Estou com a sensação de estar em um estado de neutralidade;neutro
 Sinto uma grande sensação de equanimidade;neutro
 Estou com a mente tranquila e serena;neutro
 Sinto uma grande liberdade em não ter preferências;neutro
 Estou com a sensação de que tudo está bem;neutro
 Sinto uma grande paz em estar no momento presente;neutro
 Estou em um estado de plena consciência;neutro
 Sinto uma grande serenidade em relação aos acontecimentos;neutro
 Estou com a sensação de que tudo é como deve ser;neutro
 Sinto uma grande tranquilidade em relação ao futuro;neutro
 Estou com a sensação de que não há necessidade de mudar nada;neutro
 Sinto uma grande paz em não ter expectativas;neutro
 Estou com a sensação de que não há necessidade de reagir a nada;neutro
 Sinto uma grande neutralidade em relação às emoções;neutro
 Estou em um estado de completa paz interior;neutro
 Sinto uma grande aceitação em relação aos fatos da vida;neutro
 Estou com a sensação de que não há necessidade de julgar nada;neutro
 Sinto uma grande liberdade em relação às opiniões alheias;neutro
 Estou com a sensação de que tudo é relativo e impermanente;neutro
 Sinto uma grande tranquilidade em não ter preocupações;neutro
 Estou com a sensação de que não há necessidade de forçar nada;neutro
 Sinto uma grande liberdade em não ter apegos;neutro
 Estou com a sensação de que não há necessidade de resistir a nada;neutro
 Sinto uma grande paz em não ter medo;neutro
 Estou com a sensação de que tudo é uma questão de perspectiva;neutro
 Sinto uma grande neutralidade em relação aos problemas;neutro
 Estou em um estado de completa aceitação da vida;neutro
 Sinto uma grande paz em não ter ansiedade;neutro
 Estou com a sensação de que tudo é uma grande ilusão;neutro
 Sinto uma grande liberdade em não ter preconceitos;neutro
 Estou com a sensação de que tudo é uma questão de escolha;neutro
 Sinto uma grande tranquilidade em não ter pressa;neutro
 Estou com a sensação de que não há necessidade de controlar nada;neutro
 Sinto uma grande paz em não ter arrependimentos;neutro
 Estou em um estado de completa liberdade interior;neutro
 Sinto uma profunda dor no coração;tristeza
 Estou com um vazio imenso dentro de mim;tristeza
 Sinto uma grande tristeza que parece não ter fim;tristeza
 Estou com a sensação de que tudo perdeu o sentido;tristeza
 Sinto uma grande melancolia em relação à vida;tristeza
 Estou com a sensação de que estou preso em um poço sem fundo;tristeza
 Sinto uma grande tristeza em relação ao passado;tristeza
 Estou com a sensação de que não há saída para a minha dor;tristeza
 Sinto uma grande angústia em relação ao futuro;tristeza
 Estou com a sensação de que sou incapaz de encontrar a felicidade;tristeza
 Sinto uma grande saudade de algo que nunca mais voltará;tristeza
 Estou com a sensação de que tudo é cinza e sem vida;tristeza
 Sinto uma grande sensação de solidão e abandono;tristeza
 Estou com a sensação de que tudo é inútil e sem sentido;tristeza
 Sinto uma grande tristeza em relação aos meus sonhos que nunca se realizaram;tristeza
 Estou com a sensação de que tudo é um grande peso sobre mim;tristeza
 Sinto uma grande desesperança em relação à vida;tristeza
 Estou com a sensação de que não há mais nada que valha a pena;tristeza
 Sinto uma grande tristeza em relação à perda de alguém especial;tristeza
 Estou com a sensação de que tudo é doloroso e sem esperança;tristeza
 Sinto uma grande tristeza em relação às minhas escolhas erradas;tristeza
 Estou com a sensação de que tudo é uma grande ilusão;tristeza
 Sinto uma grande tristeza em relação à minha falta de sorte;tristeza
 Estou com a sensação de que tudo é um grande fardo para mim;tristeza
 Sinto uma grande tristeza em relação à minha falta de talento;tristeza
 Estou com a sensação de que tudo é um grande vazio;tristeza
 Sinto uma grande tristeza em relação à minha vida solitária;tristeza
 Estou com a sensação de que tudo é uma grande injustiça;tristeza
 Sinto uma grande tristeza em relação às minhas perdas materiais;tristeza
 Estou com a sensação de que tudo é um grande sofrimento;tristeza
 Sinto uma grande tristeza em relação às minhas escolhas amorosas;tristeza
 Estou com a sensação de que tudo é um grande fracasso;tristeza
 Sinto uma grande tristeza em relação à minha falta de sorte no amor;tristeza
 Estou com a sensação de que tudo é uma grande mentira;tristeza
 Sinto uma grande tristeza em relação à minha falta de propósito;tristeza
 Estou com a sensação de que tudo é uma grande desilusão;tristeza
 Sinto uma grande tristeza em relação à minha falta de reconhecimento;tristeza
 Estou com a sensação de que tudo é um grande vazio existencial;tristeza
 Sinto uma grande tristeza em relação à minha falta de direção;tristeza
 Estou com a sensação de que tudo é uma grande tristeza sem fim;tristeza
 Tô nas alturas de tanta alegria mano!;alegria
 Que felicidade louca é essa que tá me dominando?!;alegria
 Tô me sentindo o rei do mundo só de tanta alegria;alegria
 Meu coração tá transbordando de tanta felicidade!;alegria
 Eu tô tão feliz que nem sei como explicar;alegria
 É alegria pra dar e vender meu chapa!;alegria
 Tô numa vibe tão positiva que nada pode me abalar;alegria
 Tô pulando de alegria feito um doido!;alegria
 Eu tô tão feliz que parece que ganhei na loteria;alegria
 É alegria pra todo lado é festa o tempo todo!;alegria
 Tô explodindo de tanta felicidade!;alegria
 Essa alegria tá tão forte que não cabe dentro de mim;alegria
 Tô nas nuvens de tanto felicidade!;alegria
 É tanta felicidade que eu nem sei por onde começar;alegria
 Tô tão feliz que parece que a vida toda tá dando certo!;alegria
 É felicidade que não acaba mais meu irmão!;alegria
 Tô tão alegre que nem sei explicar!;alegria
 Essa alegria tá me fazendo flutuar!;alegria
 Tô saltitando de tanta felicidade!;alegria
 É tanta alegria que eu nem consigo ficar parado!;alegria
 Tô transbordando de tanta felicidade!;alegria
 Essa alegria tá contagiando todo mundo ao meu redor;alegria
 Tô radiante de tanta felicidade!;alegria
 Tô tão feliz que parece que tô sonhando acordado!;alegria
 Essa alegria tá me dando asas pra voar!;alegria
 É alegria que não acaba mais é só alegria mesmo!;alegria
 Tô tão feliz que parece que o mundo inteiro tá conspirando ao meu favor!;alegria
 Tô explodindo de alegria por dentro!;alegria
 Essa alegria tá me fazendo ver tudo com mais cores!;alegria
 Tô tão alegre que parece que tô dançando a vida toda!;alegria
 É alegria que não para é uma festa sem fim!;alegria
 Tô tão feliz que nem sei como agradecer!;alegria
 Essa alegria tá me contagiando de uma forma incrível!;alegria
 Tô tão radiante que nem sei como explicar!;alegria
 É alegria pra todo lado é só festa e felicidade!;alegria
 Tô tão feliz que parece que a vida inteira tá sorrindo pra mim!;alegria
 Essa alegria tá me dando forças pra enfrentar qualquer coisa!;alegria
 Tô tão alegre que parece que tô voando!;alegria
 É felicidade que não acaba mais é só alegria mesmo!;alegria
 Tô tão feliz que parece que o universo inteiro tá conspirando ao meu favor!;alegria
 Que saco! Eu estou muito puto com essa situação!;raiva
 Essa merda não podia ter dado mais errado!;raiva
 Eu tô com uma raiva do tamanho do mundo!;raiva
 Vai tomar no cu eu não aguento mais essa palhaçada!;raiva
 Que porra é essa? Isso é inaceitável!;raiva
 Eu tô fulo da vida caralho!;raiva
 É muita falta de respeito! Tô puto demais!;raiva
 Não me enche o saco porra!;raiva
 Eu tô puto da vida com essa falta de consideração!;raiva
 Que inferno! Eu não mereço passar por isso!;raiva
 Não dá mais pra tolerar tanta incompetência!;raiva
 Eu tô pistola com essa situação!;raiva
 Que merda é essa? Tá de brincadeira comigo?;raiva
 Tô fudido de raiva não consigo nem falar direito!;raiva
 Tô muito puto com essa injustiça!;raiva
 Eu não aguento mais tanta enrolação caralho!;raiva
 Que droga! Tô com um ódio enorme!;raiva
 Eu tô com uma raiva tão grande que nem sei o que fazer!;raiva
 Vai se foder eu não mereço passar por isso!;raiva
 Que sacanagem! Tô puto demais!;raiva
 Não me faça perder a paciência porra!;raiva
 Tô com vontade de quebrar tudo tamanha a minha raiva!;raiva
 Eu tô com tanta raiva que não consigo nem raciocinar direito!;raiva
 Tá de sacanagem comigo? Eu tô puto demais!;raiva
 Eu tô fulo da vida com essa falta de respeito!;raiva
 Que raiva! Não mereço passar por isso!;raiva
 Eu tô com uma puta raiva dessa palhaçada toda!;raiva
 Tá me tirando do sério caralho!;raiva
 Que porra é essa? Eu tô com vontade de mandar tudo pro inferno!;raiva
 Tô com uma raiva tão grande que nem cabe em mim!;raiva
 Eu tô com tanta raiva que nem consigo olhar na cara dessa pessoa!;raiva
 Que ódio! Tô com vontade de gritar até ficar rouco!;raiva
 Eu tô pistola com essa situação toda!;raiva
 Tô fudido de raiva não aguento mais essa merda!;raiva
 Que droga! Eu não mereço passar por isso!;raiva
 Tô com uma raiva que nem sei explicar!;raiva
 Tá me tirando do sério caralho!;raiva
 Eu tô com vontade de bater em alguém de tanta raiva!;raiva
 Que palhaçada é essa? Tô puto demais!;raiva
 Não aguento mais tanta falta de consideração!;raiva
 Estou arrasado! Essa notícia foi um soco no estômago!;tristeza
 Estou destruído por dentro não sei como seguir em frente!;tristeza
 Meu coração está partido em mil pedaços!;tristeza
 Sinto um vazio enorme dentro de mim não consigo suportar!;tristeza
 Estou me sentindo completamente perdido e desolado!;tristeza
 A tristeza está me consumindo por inteiro é insuportável!;tristeza
 Sinto que a minha alma está chorando de tanta tristeza!;tristeza
 Estou com o coração na mão não consigo lidar com essa dor!;tristeza
 Não vejo a hora de essa dor passar é insuportável suportá-la!;tristeza
 Sinto que tudo perdeu o sentido que não há mais esperança!;tristeza
 Estou tão triste que nem sei mais como sorrir!;tristeza
 A dor é tão grande que parece que não vai passar nunca!;tristeza
 Estou vivendo um verdadeiro inferno de tristeza e desespero!;tristeza
 Sinto-me sufocado pela tristeza é como se não houvesse mais ar!;tristeza
 Estou tão triste que nem as lágrimas conseguem expressar o que sinto!;tristeza
 Sinto-me sozinho e abandonado como se ninguém mais se importasse comigo!;tristeza
 A tristeza é tão forte que até meu corpo dói!;tristeza
 Estou em um buraco negro de tristeza é como se nunca mais fosse sair dele!;tristeza
 Sinto que a vida perdeu todo o seu brilho e cor!;tristeza
 Estou tão triste que mal consigo me levantar da cama!;tristeza
 Não vejo mais sentido em nada tudo parece tão vazio!;tristeza
 Sinto-me como se estivesse preso em um pesadelo sem fim!;tristeza
 Estou tão triste que mal consigo pensar em outra coisa!;tristeza
 Sinto uma dor tão profunda que parece que nunca mais vou me recuperar!;tristeza
 A tristeza é tão grande que parece que vai me engolir por completo!;tristeza
 Estou tão triste que sinto que não tenho mais energia para nada!;tristeza
 A tristeza é tão forte que parece que estou em luto por mim mesmo!;tristeza
 Sinto-me como se tivesse sido traído pela vida!;tristeza
 Estou tão triste que parece que o mundo todo está contra mim!;tristeza
 Sinto-me completamente desolado e abandonado!;tristeza
 A tristeza é tão grande que parece que não há mais luz no fim do túnel!;tristeza
 Estou tão triste que não vejo mais graça em nada!;tristeza
 Sinto-me como se tivesse perdido tudo o que tinha de mais precioso!;tristeza
 A tristeza é tão intensa que parece que está me afogando!;tristeza
 Estou tão triste que mal consigo suportar o peso da própria existência!;tristeza
 Sinto-me como se estivesse sendo esmagado pela dor!;tristeza
 A tristeza é tão profunda que parece que nunca mais vou me recuperar!;tristeza
 Estou tão triste que parece que a felicidade é algo inatingível!;tristeza
 Sinto-me como se estivesse preso em um abismo de tristeza!;tristeza
 A tristeza é tão grande que parece que está me consumindo vivo!;tristeza
 Estou completamente indiferente a tudo não me importa mais nada!;neutro
 Não tenho nem uma pontinha de emoção estou completamente neutro!;neutro
 Estou tão apático que nem consigo sentir vontade de fazer nada!;neutro
 Não tenho interesse por nada tudo é completamente igual para mim!;neutro
 Não me importa o que acontece estou completamente neutro!;neutro
 Sinto-me como um robô sem emoções e sem reações!;neutro
 Não tenho preferência por nada estou completamente imparcial!;neutro
 Estou tão neutro que nem consigo tomar uma decisão!;neutro
 Não sinto nem alegria nem tristeza estou completamente insensível!;neutro
 Sinto-me como se estivesse em um estado de letargia sem emoções!;neutro
 Não tenho mais expectativas estou completamente neutro em relação a tudo!;neutro
 Não tenho mais motivação para fazer nada estou completamente apático!;neutro
 Não me importo nem um pouco com o que está acontecendo estou completamente neutro!;neutro
 Estou tão indiferente que nem consigo sentir raiva ou amor!;neutro
 Sinto-me como se tivesse perdido a capacidade de sentir emoções!;neutro
 Não me afeta nem um pouco o que as pessoas falam ou pensam de mim estou completamente neutro!;neutro
 Sinto-me como um observador distante sem participar de nada!;neutro
 Não tenho nenhuma reação emocional estou completamente insensível!;neutro
 Não sinto mais prazer ou felicidade estou completamente neutro!;neutro
 Não me importo nem um pouco com o que acontece ao meu redor estou completamente apático!;neutro
 Estou tão neutro que nem consigo me animar com nada!;neutro
 Não tenho mais expectativas para nada estou completamente desapegado!;neutro
 Não me importo nem um pouco com o futuro estou completamente neutro!;neutro
 Sinto-me como se estivesse em um estado de torpor sem emoções ou reações!;neutro
 Não tenho mais opinião sobre nada estou completamente neutro!;neutro
 Estou tão apático que nem consigo sentir tristeza ou alegria!;neutro
 Não tenho preferência por ninguém ou por nada estou completamente neutro!;neutro
 Não me importo nem um pouco com as consequências estou completamente indiferente!;neutro
 Sinto-me como um espectador passivo sem envolvimento emocional!;neutro
 Não tenho mais capacidade de me surpreender estou completamente neutro!;neutro
 Não me sinto mais conectado a nada estou completamente isolado!;neutro
 Estou tão neutro que nem consigo sentir medo ou ansiedade!;neutro
 Não tenho mais interesse em nada estou completamente desinteressado!;neutro
 Não sinto mais nenhum tipo de emoção estou completamente insensível!;neutro
 Não tenho mais expectativas em relação a nada estou completamente desiludido!;neutro
 Sinto-me como se estivesse em um estado de dormência sem emoções!;neutro
 Não tenho mais energia para me envolver emocionalmente estou completamente neutro!;neutro
 Estou tão apático que nem consigo me importar com o que está acontecendo!;neutro
 Não tenho mais paixão por nada estou completamente neutro!;neutro
 Eu estou nas nuvens cara tão feliz!;alegria
 Minha vibe está super alta tô alegre demais!;alegria
 A vida tá doce pra mim tô numa alegria só!;alegria
 Estou no paraíso tanta alegria que não cabe em mim!;alegria
 Tô me sentindo nas alturas pura felicidade!;alegria
 Tô com um sorrisão de orelha a orelha tão feliz!;alegria
 A felicidade tá me invadindo por completo tô tão alegre!;alegria
 Tô radiante de alegria transbordando felicidade!;alegria
 Tô como um passarinho livre e feliz demais!;alegria
 Tô pulando de felicidade como uma criança!;alegria
 Estou tão feliz que nem consigo me conter é muita alegria!;alegria
 Tô como um gato que acabou de ganhar um rato tão animado!;alegria
 Estou saltitando de tanta alegria não consigo parar!;alegria
 Tô com um coração tão cheio de alegria que parece que vai explodir!;alegria
 Tô como uma abelha na flor rodeado de tanta doçura e alegria!;alegria
 Tô me sentindo nas nuvens alegria demais!;alegria
 Tô como uma criança em um parque de diversões tão feliz!;alegria
 Tô com um sentimento tão bom que nem sei explicar!;alegria
 Tô tão alegre que até o sol brilha mais forte!;alegria
 Tô com um sorriso que não sai do rosto tanta alegria!;alegria
 Estou tão feliz que poderia abraçar o mundo inteiro!;alegria
 Tô com uma energia boa demais tanta alegria!;alegria
 Tô como uma bola saltitante de tanta felicidade!;alegria
 Estou me sentindo nas estrelas alegria demais!;alegria
 Tô como um cachorro que acabou de ganhar um osso tão animado!;alegria
 Tô com um coração que não cabe em mim tanta alegria!;alegria
 Tô como um pássaro livre voando alto na alegria!;alegria
 Estou tão feliz que poderia explodir de tanta alegria!;alegria
 Tô como um raio de sol em um dia de verão tão feliz!;alegria
 Tô com um espírito tão elevado tanta alegria!;alegria
 Estou me sentindo como um rei tanta alegria e felicidade!;alegria
 Tô como uma borboleta voando leve e feliz demais!;alegria
 Tô com um sentimento tão bom que nem consigo descrever!;alegria
 Tô como um peixe no mar nadando na felicidade!;alegria
 Estou tão feliz que parece que as estrelas brilham mais forte!;alegria
 Tô com um sorriso tão largo tanta alegria!;alegria
 Tô como um cavalo galopando livre tão animado!;alegria
 Tô com uma alegria que não cabe em mim transbordando felicidade!;alegria
 Tô como um gato se espreguiçando ao sol tão feliz!;alegria
 Tô com uma energia tão boa que só sinto alegria!;alegria
 Tô numa bad danada não consigo me animar;tristeza
 Tô me sentindo num buraco negro triste demais;tristeza
 Tô na deprê não consigo sair dessa tristeza;tristeza
 Tô com o coração partido em mil pedaços tanta tristeza;tristeza
 Tô com um nó na garganta tristeza demais;tristeza
 Tô como um peixinho fora d'água triste e deslocado;tristeza
 Tô numa fossa a tristeza me consome;tristeza
 Tô com um peso no coração tanta tristeza;tristeza
 Tô como um barco à deriva sem rumo e triste;tristeza
 Tô numa maré baixa a tristeza me domina;tristeza
 Tô como um cachorro abandonado triste e desamparado;tristeza
 Tô como um girassol sem sol triste demais;tristeza
 Tô com um vazio no peito tanta tristeza;tristeza
 Tô como um pássaro sem asas preso na tristeza;tristeza
 Tô num clima de funeral tanta tristeza no ar;tristeza
 Tô como uma flor murcha triste e sem vida;tristeza
 Tô como um relógio quebrado parado na tristeza;tristeza
 Tô como um carro sem gasolina sem forças e triste;tristeza
 Tô como uma borboleta sem cores triste demais;tristeza
 Tô como uma nuvem cinzenta triste e sombria;tristeza
 Tô como um violão desafinado triste e sem harmonia;tristeza
 Tô como um livro sem história sem graça e triste;tristeza
 Tô como um balão vazio triste e sem animação;tristeza
 Tô como um celular sem bateria sem energia e triste;tristeza
 Tô como um quebra-cabeça incompleto triste e sem sentido;tristeza
 Tô como um prato vazio sem sabor e triste;tristeza
 Tô como um dia de chuva sem guarda-chuva triste e molhado;tristeza
 Tô como um lápis sem ponta sem vida e triste;tristeza
 Tô como uma música sem letra triste e sem emoção;tristeza
 Tô como um filme sem final feliz triste e sem esperança;tristeza
 Tô como um jogo perdido triste e sem vitória;tristeza
 Tô como uma escada sem degraus sem rumo e triste;tristeza
 Tô como uma janela fechada triste e sem luz;tristeza
 Tô como um navio sem mar sem direção e triste;tristeza
 Tô como uma paisagem sem cor triste e sem vida;tristeza
 Tô como um passo sem chão triste e sem equilíbrio;tristeza
 Tô como um jardim sem flores triste e sem beleza;tristeza
 Tô como um sorriso sem alegria triste e sem graça;tristeza
 Tô como um livro rasgado triste e sem história;tristeza
 Tô como um abraço vazio triste e sem calor humano;tristeza
 Tô puto da vida não aguento mais essa situação;raiva
 Tô na bronca essa situação é inaceitável;raiva
 Tô bolado não mereço passar por isso;raiva
 Tô com a macaca essa injustiça me deixa furioso;raiva
 Tô com a pulga atrás da orelha essa história não tá batendo;raiva
 Tô com sangue nos olhos não vou deixar barato;raiva
 Tô com a faca nos dentes vou dar o troco;raiva
 Tô na luta não vou deixar que me pisem;raiva
 Tô com fogo no rabo essa provocação não vai ficar impune;raiva
 Tô com a corda toda vou mostrar quem é que manda;raiva
 Tô com o diabo no corpo essa situação me enlouquece;raiva
 Tô com a macumba forte não vou deixar que me desrespeitem;raiva
 Tô com o pé na jaca essa atitude não pode passar em branco;raiva
 Tô com a bala na agulha não vou ficar de braços cruzados;raiva
 Tô com a cabeça quente essa ofensa não vai ficar sem resposta;raiva
 Tô com a faca afiada não vou tolerar essa atitude;raiva
 Tô com o pavio curto não aguento mais essa pressão;raiva
 Tô com o sangue fervendo essa provocação é demais;raiva
 Tô com a macacada toda vamos botar pra quebrar;raiva
 Tô com a cara fechada essa situação me deixa revoltado;raiva
 Tô com o coração na boca essa injustiça é demais;raiva
 Tô com a corda no pescoço essa situação é insuportável;raiva
 Tô com a mosca atrás da orelha não confio nessa história;raiva
 Tô com a paciência esgotada não aguento mais essa enrolação;raiva
 Tô com a pulga na orelha essa atitude é suspeita demais;raiva
 Tô com o saco cheio essa situação é inadmissível;raiva
 Tô com o sangue nos zóio não vou tolerar essa falta de respeito;raiva
 Tô com a unha encravada essa provocação é demais;raiva
 Tô com a barriga cheia dessa palhaçada essa situação é uma piada;raiva
 Tô com a moral no chão essa humilhação é demais;raiva
 Tô com o olho grande essa atitude é desleal;raiva
 Tô com o peito cheio de ódio essa provocação é inaceitável;raiva
 Tô com o pé na porta essa situação não pode continuar;raiva
 Tô com o sangue azul essa falta de consideração me enoja;raiva
 Tô com a cara no chão essa derrota é uma injustiça;raiva
 Tô com o dedo no gatilho não vou deixar essa situação passar em branco;raiva
 Tô com o espírito de guerra não vou deixar que me pisem;raiva
 Tô na paz nada me abala;neutro
 Tô de boa não tô nem aí pra essa situação;neutro
 Tô na tranquilidade não vou me estressar;neutro
 Tô na dele não vou me envolver nessa confusão;neutro
 Tô no zero a zero não tenho opinião formada;neutro
 Tô na inércia não quero me envolver nessa questão;neutro
 Tô no modo avião não tô ligando pra nada;neutro
 Tô na moita observando tudo de longe;neutro
 Tô na neutralidade não quero tomar partido;neutro
 Tô no vácuo não vou me manifestar;neutro
 Tô no banco de reservas aguardando minha vez;neutro
 Tô na expectativa esperando pra ver o desenrolar da situação;neutro
 Tô no purgatório nem quente nem frio;neutro
 Tô na média não tô nem feliz nem triste;neutro
 Tô na corda bamba não tenho certeza do que fazer;neutro
 Tô na defensiva não quero me expor;neutro
 Tô no muro não quero escolher lado;neutro
 Tô na base do tanto faz não tenho preferência;neutro
 Tô no limbo sem opinião formada;neutro
 Tô na zona de conforto não quero mudar nada;neutro
 Tô no modo automático fazendo as coisas sem pensar;neutro
 Tô na diagonal não tô nem aí pra essa situação;neutro
 Tô no modo fantasma não quero ser notado;neutro
 Tô na categoria nem lá nem cá não tenho uma posição definida;neutro
 Tô no estado de letargia não tô nem animado nem desanimado;neutro
 Tô na dúvida não sei o que pensar;neutro
 Tô na indefinição não quero tomar decisões agora;neutro
 Tô na fase de deixa a vida me levar sem pressa;neutro
 Tô na posição de tanto faz como tanto fez sem preferência;neutro
 Tô na fila do meio não quero escolher entre um ou outro;neutro
 Tô na fase de espera aguardando por um momento melhor;neutro
 Tô na fase de levando a vida sem preocupações;neutro
 Tô na posição de expectador só observando o que acontece;neutro
 Tô na fase do deixa rolar sem planos definidos;neutro
 Tô na zona cinzenta sem opinião formada;neutro
 Tô na fase de tô nem aí sem preocupações;neutro
 Tô na fase de vou deixar fluir sem pressa;neutro
 Tô na posição de deixa pra lá sem interesse;neutro
 Estou tão irritado que não consigo nem falar;raiva
 Sinto como se fosse explodir de tanta raiva;raiva
 Não acredito que você fez isso de propósito para me irritar;raiva
 Essa situação me deixa furioso;raiva
 Estou com tanta raiva que minhas mãos estão tremendo;raiva
 Não consigo lidar com essa raiva sozinho;raiva
 Você me tirou do sério;raiva
 Estou tão zangado que preciso me afastar um pouco;raiva
 Por que você sempre tem que fazer as coisas do seu jeito?;raiva
 Estou tão bravo que não consigo nem pensar direito;raiva
 Essa atitude é completamente inaceitável e me deixa com muita raiva;raiva
